{
    "operation_id":  "op:query:structured:001",
    "scope_id":  "workspace:example",
    "query":  {
                  "kind":  "structured",
                  "filters":  {
                                  "lifecycle_state":  [
                                                          "active"
                                                      ],
                                  "availability_state":  [
                                                             "available"
                                                         ],
                                  "retention_state":  [
                                                          "retained"
                                                      ],
                                  "validation_state":  [
                                                           "corroborated"
                                                       ]
                              }
              },
    "pagination":  {
                       "limit":  25
                   },
    "ordering":  {
                     "tie_break":  [
                                       "sequence",
                                       "object_id",
                                       "version_id"
                                   ]
                 }
}
